{
  "$schema": "https://json-schema.org/draft/2020-12/schema",
  "$id": "urn:otdp:profile-catalog:0.2.0",
  "type": "object",
  "properties": {
    "catalog_version": {
      "const": "0.2.0"
    },
    "otdp_version": {
      "const": "0.2.0"
    },
    "profiles": {
      "type": "array",
      "items": {
        "type": "object",
        "properties": {
          "id": {
            "type": "string",
            "minLength": 1
          },
          "title": {
            "type": "string",
            "minLength": 1
          },
          "channel_roles": {
            "type": "array",
            "items": {
              "type": "string",
              "minLength": 1
            },
            "minItems": 1,
            "uniqueItems": true
          },
          "required_actions": {
            "type": "array",
            "items": {
              "type": "string",
              "minLength": 1
            },
            "minItems": 1,
            "uniqueItems": true
          },
          "optional_actions": {
            "type": "array",
            "items": {
              "type": "string",
              "minLength": 1
            },
            "minItems": 0
          }
        },
        "required": [
          "id",
          "title",
          "channel_roles",
          "required_actions",
          "optional_actions"
        ],
        "additionalProperties": false
      },
      "minItems": 1
    },
    "actions": {
      "type": "object",
      "minProperties": 1,
      "additionalProperties": {
        "type": "object",
        "properties": {
          "description": {
            "type": "string",
            "minLength": 1
          },
          "input_schema": {
            "type": "object"
          },
          "output_schema": {
            "type": "object"
          },
          "side_effect": {
            "enum": [
              "none",
              "state_change"
            ]
          },
          "lifecycle": {
            "enum": [
              "direct",
              "acquisition"
            ]
          }
        },
        "required": [
          "description",
          "input_schema",
          "output_schema",
          "side_effect",
          "lifecycle"
        ],
        "additionalProperties": false
      }
    }
  },
  "required": [
    "catalog_version",
    "otdp_version",
    "profiles",
    "actions"
  ],
  "additionalProperties": false
}
