{
  "catalog_version": "0.2.0",
  "otdp_version": "0.2.0",
  "profiles": [
    {
      "id": "otdp.dc_psu/1.0.0",
      "title": "DC power supply",
      "channel_roles": [
        "source"
      ],
      "required_actions": [
        "otdp.dc_psu.configure/1.0.0",
        "otdp.dc_psu.output/1.0.0",
        "otdp.dc_psu.measure/1.0.0"
      ],
      "optional_actions": []
    },
    {
      "id": "otdp.dmm/1.0.0",
      "title": "Digital multimeter",
      "channel_roles": [
        "measure"
      ],
      "required_actions": [
        "otdp.dmm.configure/1.0.0",
        "otdp.dmm.measure/1.0.0"
      ],
      "optional_actions": []
    },
    {
      "id": "otdp.oscilloscope/1.0.0",
      "title": "Oscilloscope",
      "channel_roles": [
        "analogue_input"
      ],
      "required_actions": [
        "otdp.oscilloscope.configure/1.0.0",
        "otdp.oscilloscope.arm/1.0.0",
        "otdp.oscilloscope.fetch/1.0.0",
        "otdp.oscilloscope.abort/1.0.0"
      ],
      "optional_actions": [
        "otdp.oscilloscope.trigger/1.0.0"
      ]
    },
    {
      "id": "otdp.logic_analyser/1.0.0",
      "title": "Logic analyser and bus decoding",
      "channel_roles": [
        "digital_input"
      ],
      "required_actions": [
        "otdp.logic_analyser.configure/1.0.0",
        "otdp.logic_analyser.arm/1.0.0",
        "otdp.logic_analyser.fetch/1.0.0",
        "otdp.logic_analyser.abort/1.0.0"
      ],
      "optional_actions": [
        "otdp.logic_analyser.trigger/1.0.0",
        "otdp.logic_analyser.decode/1.0.0"
      ]
    },
    {
      "id": "otdp.function_generator/1.0.0",
      "title": "Function and arbitrary waveform generator",
      "channel_roles": [
        "source"
      ],
      "required_actions": [
        "otdp.function_generator.configure/1.0.0",
        "otdp.function_generator.output/1.0.0"
      ],
      "optional_actions": [
        "otdp.function_generator.upload/1.0.0"
      ]
    },
    {
      "id": "otdp.electronic_load/1.0.0",
      "title": "Electronic load",
      "channel_roles": [
        "sink"
      ],
      "required_actions": [
        "otdp.electronic_load.configure/1.0.0",
        "otdp.electronic_load.output/1.0.0",
        "otdp.electronic_load.measure/1.0.0"
      ],
      "optional_actions": []
    },
    {
      "id": "otdp.smu/1.0.0",
      "title": "Source-measure unit",
      "channel_roles": [
        "source_measure"
      ],
      "required_actions": [
        "otdp.smu.configure/1.0.0",
        "otdp.smu.output/1.0.0",
        "otdp.smu.measure/1.0.0"
      ],
      "optional_actions": [
        "otdp.smu.configure_sweep/1.0.0",
        "otdp.smu.arm/1.0.0",
        "otdp.smu.trigger/1.0.0",
        "otdp.smu.fetch/1.0.0",
        "otdp.smu.abort/1.0.0"
      ]
    },
    {
      "id": "otdp.daq/1.0.0",
      "title": "Data acquisition and digitiser",
      "channel_roles": [
        "analogue_input",
        "digital_input"
      ],
      "required_actions": [
        "otdp.daq.configure/1.0.0",
        "otdp.daq.arm/1.0.0",
        "otdp.daq.fetch/1.0.0",
        "otdp.daq.abort/1.0.0"
      ],
      "optional_actions": [
        "otdp.daq.trigger/1.0.0"
      ]
    },
    {
      "id": "otdp.embedded_controller/1.0.0",
      "title": "Embedded-controller telemetry and control",
      "channel_roles": [
        "measure",
        "digital_input",
        "digital_output",
        "configuration"
      ],
      "required_actions": [
        "otdp.embedded_controller.telemetry/1.0.0"
      ],
      "optional_actions": [
        "otdp.embedded_controller.set_control/1.0.0"
      ]
    },
    {
      "id": "otdp.switch_matrix/1.0.0",
      "title": "Relay fixture and switch matrix",
      "channel_roles": [
        "switch"
      ],
      "required_actions": [
        "otdp.switch_matrix.route/1.0.0",
        "otdp.switch_matrix.open_all/1.0.0",
        "otdp.switch_matrix.read_routes/1.0.0"
      ],
      "optional_actions": []
    },
    {
      "id": "otdp.spectrum_analyser/1.0.0",
      "title": "Spectrum analyser",
      "channel_roles": [
        "rf_input"
      ],
      "required_actions": [
        "otdp.spectrum_analyser.configure/1.0.0",
        "otdp.spectrum_analyser.arm/1.0.0",
        "otdp.spectrum_analyser.fetch/1.0.0",
        "otdp.spectrum_analyser.abort/1.0.0"
      ],
      "optional_actions": [
        "otdp.spectrum_analyser.trigger/1.0.0"
      ]
    },
    {
      "id": "otdp.vna/1.0.0",
      "title": "Vector network analyser",
      "channel_roles": [
        "rf_port"
      ],
      "required_actions": [
        "otdp.vna.configure/1.0.0",
        "otdp.vna.arm/1.0.0",
        "otdp.vna.fetch/1.0.0",
        "otdp.vna.abort/1.0.0"
      ],
      "optional_actions": [
        "otdp.vna.trigger/1.0.0"
      ]
    }
  ],
  "actions": {
    "otdp.dc_psu.configure/1.0.0": {
      "description": "configure for dc_psu; normative behaviour in device-classes.md.",
      "input_schema": {
        "type": "object",
        "properties": {
          "configuration_id": {
            "type": "string",
            "minLength": 1
          },
          "channel": {
            "type": "string",
            "pattern": "^[a-z][a-z0-9_]*$"
          },
          "voltage_v": {
            "type": "number"
          },
          "current_limit_a": {
            "type": "number",
            "exclusiveMinimum": 0
          },
          "ovp_v": {
            "type": "number",
            "exclusiveMinimum": 0
          },
          "ocp_a": {
            "type": "number",
            "exclusiveMinimum": 0
          }
        },
        "required": [
          "configuration_id",
          "channel",
          "voltage_v",
          "current_limit_a",
          "ovp_v",
          "ocp_a"
        ],
        "additionalProperties": false,
        "$schema": "https://json-schema.org/draft/2020-12/schema",
        "$id": "urn:otdp:action:dc_psu.configure:1.0.0:input"
      },
      "output_schema": {
        "type": "object",
        "properties": {
          "configuration_id": {
            "type": "string",
            "minLength": 1
          },
          "effective_configuration": {
            "type": "object",
            "properties": {
              "configuration_id": {
                "type": "string",
                "minLength": 1
              },
              "channel": {
                "type": "string",
                "pattern": "^[a-z][a-z0-9_]*$"
              },
              "voltage_v": {
                "type": "number"
              },
              "current_limit_a": {
                "type": "number",
                "exclusiveMinimum": 0
              },
              "ovp_v": {
                "type": "number",
                "exclusiveMinimum": 0
              },
              "ocp_a": {
                "type": "number",
                "exclusiveMinimum": 0
              }
            },
            "required": [
              "configuration_id",
              "channel",
              "voltage_v",
              "current_limit_a",
              "ovp_v",
              "ocp_a"
            ],
            "additionalProperties": false
          }
        },
        "required": [
          "configuration_id",
          "effective_configuration"
        ],
        "additionalProperties": false,
        "$schema": "https://json-schema.org/draft/2020-12/schema",
        "$id": "urn:otdp:action:dc_psu.configure:1.0.0:output"
      },
      "side_effect": "state_change",
      "lifecycle": "direct"
    },
    "otdp.dc_psu.output/1.0.0": {
      "description": "output for dc_psu; normative behaviour in device-classes.md.",
      "input_schema": {
        "type": "object",
        "properties": {
          "channel": {
            "type": "string",
            "pattern": "^[a-z][a-z0-9_]*$"
          },
          "enabled": {
            "type": "boolean"
          },
          "configuration_id": {
            "type": "string",
            "minLength": 1
          }
        },
        "required": [
          "channel",
          "enabled"
        ],
        "additionalProperties": false,
        "allOf": [
          {
            "if": {
              "properties": {
                "enabled": {
                  "const": true
                }
              },
              "required": [
                "enabled"
              ]
            },
            "then": {
              "required": [
                "configuration_id"
              ]
            }
          }
        ],
        "$schema": "https://json-schema.org/draft/2020-12/schema",
        "$id": "urn:otdp:action:dc_psu.output:1.0.0:input"
      },
      "output_schema": {
        "type": "object",
        "properties": {
          "channel": {
            "type": "string",
            "pattern": "^[a-z][a-z0-9_]*$"
          },
          "enabled": {
            "type": "boolean"
          },
          "assurance": {
            "enum": [
              "readback",
              "physical"
            ]
          }
        },
        "required": [
          "channel",
          "enabled",
          "assurance"
        ],
        "additionalProperties": false,
        "$schema": "https://json-schema.org/draft/2020-12/schema",
        "$id": "urn:otdp:action:dc_psu.output:1.0.0:output"
      },
      "side_effect": "state_change",
      "lifecycle": "direct"
    },
    "otdp.dc_psu.measure/1.0.0": {
      "description": "measure for dc_psu; normative behaviour in device-classes.md.",
      "input_schema": {
        "type": "object",
        "properties": {
          "channels": {
            "type": "array",
            "items": {
              "type": "string",
              "pattern": "^[a-z][a-z0-9_]*$"
            },
            "uniqueItems": true,
            "minItems": 1
          },
          "configuration_id": {
            "type": "string",
            "minLength": 1
          }
        },
        "required": [
          "channels"
        ],